[
  {
    "Item": "IFP1101",
    "Produto": "Seated Shoulder Press",
    "Qtd. Caixas Total": 1,
    "Tipo Caixa": "A",
    "COMPRIMENTO": "1385",
    "LARGURA": "875",
    "ALTURA": "380",
    "Qtd. Tipos de Medida": 1,
    "Qtd. Caixas por Medida": 1,
    "Peso Bruto Total (kg)": 97.8,
    "Peso Médio por Caixa (kg)": 97.8,
    "Peso Estimado do Grupo (kg)": 97.8
  },
  {
    "Item": "IFP1103",
    "Produto": "Standing Lateral Raise",
    "Qtd. Caixas Total": 1,
    "Tipo Caixa": "A",
    "COMPRIMENTO": "1215",
    "LARGURA": "945",
    "ALTURA": "230",
    "Qtd. Tipos de Medida": 1,
    "Qtd. Caixas por Medida": 1,
    "Peso Bruto Total (kg)": 62.5,
    "Peso Médio por Caixa (kg)": 62.5,
    "Peso Estimado do Grupo (kg)": 62.5
  },
  {
    "Item": "IFP1201",
    "Produto": "Seated Chest Press",
    "Qtd. Caixas Total": 1,
    "Tipo Caixa": "A",
    "COMPRIMENTO": "1175",
    "LARGURA": "1065",
    "ALTURA": "350",
    "Qtd. Tipos de Medida": 1,
    "Qtd. Caixas por Medida": 1,
    "Peso Bruto Total (kg)": 72,
    "Peso Médio por Caixa (kg)": 72,
    "Peso Estimado do Grupo (kg)": 72
  },
  {
    "Item": "IFP1206",
    "Produto": "Standing Chest Fly",
    "Qtd. Caixas Total": 1,
    "Tipo Caixa": "A",
    "COMPRIMENTO": "1575",
    "LARGURA": "975",
    "ALTURA": "230",
    "Qtd. Tipos de Medida": 1,
    "Qtd. Caixas por Medida": 1,
    "Peso Bruto Total (kg)": 77.6,
    "Peso Médio por Caixa (kg)": 77.6,
    "Peso Estimado do Grupo (kg)": 77.6
  },
  {
    "Item": "IFP1301",
    "Produto": "Lat Pulldown",
    "Qtd. Caixas Total": 2,
    "Tipo Caixa": "A",
    "COMPRIMENTO": "1335",
    "LARGURA": "505",
    "ALTURA": "340",
    "Qtd. Tipos de Medida": 2,
    "Qtd. Caixas por Medida": 1,
    "Peso Bruto Total (kg)": 105.5,
    "Peso Médio por Caixa (kg)": 52.75,
    "Peso Estimado do Grupo (kg)": 59
  },
  {
    "Item": "IFP1301",
    "Produto": "Lat Pulldown",
    "Qtd. Caixas Total": 2,
    "Tipo Caixa": "B",
    "COMPRIMENTO": "1735",
    "LARGURA": "515",
    "ALTURA": "230",
    "Qtd. Tipos de Medida": 2,
    "Qtd. Caixas por Medida": 1,
    "Peso Bruto Total (kg)": 105.5,
    "Peso Médio por Caixa (kg)": 52.75,
    "Peso Estimado do Grupo (kg)": 46.5
  },
  {
    "Item": "IFP1302",
    "Produto": "Seated Row",
    "Qtd. Caixas Total": 1,
    "Tipo Caixa": "A",
    "COMPRIMENTO": "1345",
    "LARGURA": "875",
    "ALTURA": "360",
    "Qtd. Tipos de Medida": 1,
    "Qtd. Caixas por Medida": 1,
    "Peso Bruto Total (kg)": 85.5,
    "Peso Médio por Caixa (kg)": 85.5,
    "Peso Estimado do Grupo (kg)": 85.5
  },
  {
    "Item": "IFP1305",
    "Produto": "T-Bar Row",
    "Qtd. Caixas Total": 1,
    "Tipo Caixa": "A",
    "COMPRIMENTO": "1325",
    "LARGURA": "535",
    "ALTURA": "340",
    "Qtd. Tipos de Medida": 1,
    "Qtd. Caixas por Medida": 1,
    "Peso Bruto Total (kg)": 63.3,
    "Peso Médio por Caixa (kg)": 63.3,
    "Peso Estimado do Grupo (kg)": 63.3
  },
  {
    "Item": "IFP1501",
    "Produto": "Bicep Curl",
    "Qtd. Caixas Total": 1,
    "Tipo Caixa": "A",
    "COMPRIMENTO": "1285",
    "LARGURA": "755",
    "ALTURA": "340",
    "Qtd. Tipos de Medida": 1,
    "Qtd. Caixas por Medida": 1,
    "Peso Bruto Total (kg)": 63.5,
    "Peso Médio por Caixa (kg)": 63.5,
    "Peso Estimado do Grupo (kg)": 63.5
  },
  {
    "Item": "IFP1604",
    "Produto": "Prone Leg Curl",
    "Qtd. Caixas Total": 1,
    "Tipo Caixa": "A",
    "COMPRIMENTO": "1115",
    "LARGURA": "885",
    "ALTURA": "290",
    "Qtd. Tipos de Medida": 1,
    "Qtd. Caixas por Medida": 1,
    "Peso Bruto Total (kg)": 81.5,
    "Peso Médio por Caixa (kg)": 81.5,
    "Peso Estimado do Grupo (kg)": 81.5
  },
  {
    "Item": "IFP1605",
    "Produto": "Seated Leg Extension",
    "Qtd. Caixas Total": 1,
    "Tipo Caixa": "A",
    "COMPRIMENTO": "1170",
    "LARGURA": "825",
    "ALTURA": "330",
    "Qtd. Tipos de Medida": 1,
    "Qtd. Caixas por Medida": 1,
    "Peso Bruto Total (kg)": 71,
    "Peso Médio por Caixa (kg)": 71,
    "Peso Estimado do Grupo (kg)": 71
  },
  {
    "Item": "IFP1613",
    "Produto": "Vertical Leg Press",
    "Qtd. Caixas Total": 1,
    "Tipo Caixa": "A",
    "COMPRIMENTO": "1765",
    "LARGURA": "1165",
    "ALTURA": "240",
    "Qtd. Tipos de Medida": 1,
    "Qtd. Caixas por Medida": 1,
    "Peso Bruto Total (kg)": 120,
    "Peso Médio por Caixa (kg)": 120,
    "Peso Estimado do Grupo (kg)": 120
  },
  {
    "Item": "IFP1615",
    "Produto": "Belt Squat",
    "Qtd. Caixas Total": 1,
    "Tipo Caixa": "A",
    "COMPRIMENTO": "1280",
    "LARGURA": "770",
    "ALTURA": "280",
    "Qtd. Tipos de Medida": 1,
    "Qtd. Caixas por Medida": 1,
    "Peso Bruto Total (kg)": 84,
    "Peso Médio por Caixa (kg)": 84,
    "Peso Estimado do Grupo (kg)": 84
  },
  {
    "Item": "IFP1616",
    "Produto": "Vertical Hip Thrust",
    "Qtd. Caixas Total": 1,
    "Tipo Caixa": "A",
    "COMPRIMENTO": "1255",
    "LARGURA": "825",
    "ALTURA": "340",
    "Qtd. Tipos de Medida": 1,
    "Qtd. Caixas por Medida": 1,
    "Peso Bruto Total (kg)": 75,
    "Peso Médio por Caixa (kg)": 75,
    "Peso Estimado do Grupo (kg)": 75
  },
  {
    "Item": "IFP1617",
    "Produto": "Hack Squat",
    "Qtd. Caixas Total": 2,
    "Tipo Caixa": "A",
    "COMPRIMENTO": "1515",
    "LARGURA": "905",
    "ALTURA": "480",
    "Qtd. Tipos de Medida": 2,
    "Qtd. Caixas por Medida": 1,
    "Peso Bruto Total (kg)": 128.2,
    "Peso Médio por Caixa (kg)": 64.1,
    "Peso Estimado do Grupo (kg)": 77.5
  },
  {
    "Item": "IFP1617",
    "Produto": "Hack Squat",
    "Qtd. Caixas Total": 2,
    "Tipo Caixa": "B",
    "COMPRIMENTO": "1865",
    "LARGURA": "355",
    "ALTURA": "230",
    "Qtd. Tipos de Medida": 2,
    "Qtd. Caixas por Medida": 1,
    "Peso Bruto Total (kg)": 128.2,
    "Peso Médio por Caixa (kg)": 64.1,
    "Peso Estimado do Grupo (kg)": 50.7
  },
  {
    "Item": "IFP1619",
    "Produto": "Reverse Hyperextension",
    "Qtd. Caixas Total": 1,
    "Tipo Caixa": "A",
    "COMPRIMENTO": "1285",
    "LARGURA": "805",
    "ALTURA": "290",
    "Qtd. Tipos de Medida": 1,
    "Qtd. Caixas por Medida": 1,
    "Peso Bruto Total (kg)": 72.4,
    "Peso Médio por Caixa (kg)": 72.4,
    "Peso Estimado do Grupo (kg)": 72.4
  },
  {
    "Item": "IFP1622",
    "Produto": "Standing Hip Abductor",
    "Qtd. Caixas Total": 1,
    "Tipo Caixa": "A",
    "COMPRIMENTO": "1425",
    "LARGURA": "835",
    "ALTURA": "350",
    "Qtd. Tipos de Medida": 1,
    "Qtd. Caixas por Medida": 1,
    "Peso Bruto Total (kg)": 92.1,
    "Peso Médio por Caixa (kg)": 92.1,
    "Peso Estimado do Grupo (kg)": 92.1
  },
  {
    "Item": "IFP1623",
    "Produto": "Seated Calf Raise",
    "Qtd. Caixas Total": 1,
    "Tipo Caixa": "A",
    "COMPRIMENTO": "1575",
    "LARGURA": "595",
    "ALTURA": "200",
    "Qtd. Tipos de Medida": 1,
    "Qtd. Caixas por Medida": 1,
    "Peso Bruto Total (kg)": 43,
    "Peso Médio por Caixa (kg)": 43,
    "Peso Estimado do Grupo (kg)": 43
  },
  {
    "Item": "IFP1706",
    "Produto": "Biceps/Triceps",
    "Qtd. Caixas Total": 1,
    "Tipo Caixa": "A",
    "COMPRIMENTO": "1315",
    "LARGURA": "785",
    "ALTURA": "310",
    "Qtd. Tipos de Medida": 1,
    "Qtd. Caixas por Medida": 1,
    "Peso Bruto Total (kg)": 53.6,
    "Peso Médio por Caixa (kg)": 53.6,
    "Peso Estimado do Grupo (kg)": 53.6
  },
  {
    "Item": "IFP1707",
    "Produto": "Leverage Squat/Calf",
    "Qtd. Caixas Total": 1,
    "Tipo Caixa": "A",
    "COMPRIMENTO": "1480",
    "LARGURA": "1170",
    "ALTURA": "340",
    "Qtd. Tipos de Medida": 1,
    "Qtd. Caixas por Medida": 1,
    "Peso Bruto Total (kg)": 125.5,
    "Peso Médio por Caixa (kg)": 125.5,
    "Peso Estimado do Grupo (kg)": 125.5
  },
  {
    "Item": "IFP1711",
    "Produto": "Hack Squat/Leg Press",
    "Qtd. Caixas Total": 2,
    "Tipo Caixa": "A",
    "COMPRIMENTO": "1575",
    "LARGURA": "875",
    "ALTURA": "240",
    "Qtd. Tipos de Medida": 2,
    "Qtd. Caixas por Medida": 1,
    "Peso Bruto Total (kg)": 162.3,
    "Peso Médio por Caixa (kg)": 81.15,
    "Peso Estimado do Grupo (kg)": 83
  },
  {
    "Item": "IFP1711",
    "Produto": "Hack Squat/Leg Press",
    "Qtd. Caixas Total": 2,
    "Tipo Caixa": "B",
    "COMPRIMENTO": "855",
    "LARGURA": "655",
    "ALTURA": "450",
    "Qtd. Tipos de Medida": 2,
    "Qtd. Caixas por Medida": 1,
    "Peso Bruto Total (kg)": 162.3,
    "Peso Médio por Caixa (kg)": 81.15,
    "Peso Estimado do Grupo (kg)": 79.3
  },
  {
    "Item": "IFP1721",
    "Produto": "Half Cage/Smith Machine",
    "Qtd. Caixas Total": 1,
    "Tipo Caixa": "A",
    "COMPRIMENTO": "2315",
    "LARGURA": "625",
    "ALTURA": "250",
    "Qtd. Tipos de Medida": 1,
    "Qtd. Caixas por Medida": 1,
    "Peso Bruto Total (kg)": 147.5,
    "Peso Médio por Caixa (kg)": 147.5,
    "Peso Estimado do Grupo (kg)": 147.5
  },
  {
    "Item": "IFP1721OPT1",
    "Produto": "Lat Pulldown/Seated Row Attachment",
    "Qtd. Caixas Total": 2,
    "Tipo Caixa": "A",
    "COMPRIMENTO": "2055",
    "LARGURA": "255",
    "ALTURA": "310",
    "Qtd. Tipos de Medida": 2,
    "Qtd. Caixas por Medida": 1,
    "Peso Bruto Total (kg)": 44.7,
    "Peso Médio por Caixa (kg)": 22.35,
    "Peso Estimado do Grupo (kg)": 28.7
  },
  {
    "Item": "IFP1721OPT1",
    "Produto": "Lat Pulldown/Seated Row Attachment",
    "Qtd. Caixas Total": 2,
    "Tipo Caixa": "B",
    "COMPRIMENTO": "765",
    "LARGURA": "405",
    "ALTURA": "190",
    "Qtd. Tipos de Medida": 2,
    "Qtd. Caixas por Medida": 1,
    "Peso Bruto Total (kg)": 44.7,
    "Peso Médio por Caixa (kg)": 22.35,
    "Peso Estimado do Grupo (kg)": 16
  }
]
